{
  "contract_version": "v5",
  "input_bundle": {
    "uri": "file:///tmp/sec-review-fixtures/pull-request-review.tar.zst",
    "digest": "sha256:0000000000000000000000000000000000000000000000000000000000000000",
    "media_type": "application/tar+zstd",
    "size_bytes": 0
  },
  "review_intent": {
    "objective": "audit"
  },
  "pr": {
    "number": 42,
    "title": "Harden webhook signature validation",
    "repo_full_name": "octo-org/example"
  }
}
